{
  "schemaVersion": "1.0",
  "runId": "run-demo-001",
  "snapshotId": "snap-demo-001",
  "suiteId": "cross-surface-demo",
  "source": "demo",
  "runner": "playwright-fixture",
  "verifiedBy": null,
  "startedAt": "2026-10-12T14:00:00Z",
  "finishedAt": "2026-10-12T14:00:09Z",
  "exitCode": 0,
  "results": [
    {
      "scenarioId": "registration-admin",
      "criterionIds": [
        "AC1"
      ],
      "surfaceKeys": [
        "live",
        "admin"
      ],
      "status": "passed",
      "attempt": 1,
      "expected": "Vytvořený účastník se objeví v adminu.",
      "observed": "Ilustrační demo výsledek, nikoli zde provedený test.",
      "assertions": [
        {
          "description": "Stejné participant ID na live a admin surface.",
          "passed": true
        }
      ],
      "evidenceIds": [
        "artifact-demo-admin"
      ],
      "failureKind": null,
      "durationMs": 9000
    },
    {
      "scenarioId": "registration-native",
      "criterionIds": [
        "AC2"
      ],
      "surfaceKeys": [
        "mobile"
      ],
      "status": "not_run",
      "attempt": 1,
      "expected": "Účastník se zobrazí v native aplikaci.",
      "observed": "Není nakonfigurovaný skutečný native build a zařízení.",
      "assertions": [],
      "evidenceIds": [],
      "failureKind": "configuration",
      "durationMs": 0
    }
  ]
}
